id,appId,title,icon,url,price,currency,free,description,developer,developerUrl,developerId,genre,genreId,released
938003185,com.robinhood.release.Robinhood,Robinhood: Investing for All,https://is2-ssl.mzstatic.com/image/thumb/Purple115/v4/b4/cc/25/b4cc2576-163f-ec05-dad3-0c3b4ccf6ea9/AppIcon-0-0-1x_U007emarketing-0-0-0-7-0-0-sRGB-0-0-0-GLES2_U002c0-512MB-85-220-0-0.png/100x100bb.png,https://apps.apple.com/us/app/robinhood-investing-for-all/id938003185?uo=2,0,USD,true,"Invest in stocks, options, and funds with Robinhood Financial. Buy and sell crypto like Bitcoin and Dogecoin with Robinhood Crypto. All commission-free with no account minimums. Other fees may apply*.

Whether you’re new to the markets or an experienced trader, we have the tools to help you invest with greater confidence. From commission-free trading to award winning design, investing is now more approachable and affordable. To get you started, you’ll get your first stock on us. Certain limitations apply.

Here's what you get when you join Robinhood:
• Finance Explained - We’ll help you better understand financial markets so you can invest in funds, stocks, and options, all commission-free.

• Trading Tools - Before buying a stock, ETF, or cryptocurrency, you can access real-time market data, see analyst ratings, read relevant news articles, and get notified about important events.  

• Secure and Trusted - Your security is our priority. Robinhood uses cutting-edge security measures to help protect investor assets and personal information.

Plus, we’ve got a full range of products to help make your money work harder for you.

STOCKS, FUNDS, OPTIONS, AND CRYPTO
With Robinhood Financial, you can invest in stocks, funds, and options. You can also buy and sell cryptocurrencies like Bitcoin (BTC), Ethereum (ETH), Litecoin (LTC), and Dogecoin (DOGE) with Robinhood Crypto.

CASH MANAGEMENT
Get your paycheck, pay bills, send checks, and more. To top it off, earn a competitive interest** rate on your uninvested cash and get more flexibility with your brokerage account.

Disclosures
*Other fees may apply. View Robinhood Financial's fee schedule at rbnhd.co/fees to learn more.

**Cash Management is an added feature to your Robinhood Financial LLC brokerage account. The Annual Percentage Yield (APY) is paid by program banks and may change at any time at the program banks’ discretion. Interest is earned on uninvested cash swept from the brokerage account to the program banks. Neither Robinhood Financial LLC nor any of its affiliates are banks. The debit card is issued by Sutton Bank, member FDIC, pursuant to license by Mastercard® International Incorporated.

Securities trading offered through Robinhood Financial LLC, member SIPC and FINRA.  See our Customer Relationship Summary at rbnhd.co/crs.

Cryptocurrency trading offered through Robinhood Crypto, LLC. Robinhood Crypto is licensed to engage in virtual currency business activity by the New York State Department of Financial Services and is not a member of FINRA or SIPC. Cryptocurrencies are not stocks and your cryptocurrency investments are not products protected by either the FDIC or SIPC.

The free stock program is subject to certain limitations and the offer is available to new users only, subject to the terms and conditions at rbnhd.co/freestock. Free stock chosen randomly from the program’s inventory. Investing is risky.

All investments involve risk, including the possible loss of principal. Investors should consider their investment objectives and risks carefully before investing.

Recurring investments do not ensure a profit or guarantee against loss. Not all securities on Robinhood are eligible for recurring investments. Recurring investments may result in a purchase of fractional shares, which are illiquid outside of Robinhood and not transferable. For a complete explanation of conditions, restrictions and limitations associated with fractional shares, visit robinhood.com.

Robinhood Financial LLC and Robinhood Crypto, LLC are wholly-owned subsidiaries of Robinhood Markets, Inc.","Robinhood Markets, Inc.",https://apps.apple.com/us/developer/robinhood-markets-inc/id938003184?uo=2,938003184?uo=2,Finance,6015,2014-12-11T03:33:44-07:00
886427730,com.vilcsak.bitcoin2,Coinbase – Buy & sell Bitcoin,https://is2-ssl.mzstatic.com/image/thumb/Purple125/v4/c3/a7/b7/c3a7b78b-9fff-7c18-7f80-bd0ff2302a1f/AppIcon-0-0-1x_U007emarketing-0-0-0-10-0-0-sRGB-0-0-0-GLES2_U002c0-512MB-85-220-0-0.png/100x100bb.png,https://apps.apple.com/us/app/coinbase-buy-sell-bitcoin/id886427730?uo=2,0,USD,true,"Coinbase: the simple, safe way to buy, manage and sell your cryptocurrency.

We’re the world’s largest cryptocurrency exchange, with over 25 million users across 32 countries worldwide. Coinbase allows you to securely buy, store and sell cryptocurrencies like Bitcoin, Bitcoin Cash, Ethereum, Ethereum Classic, Litecoin, and many more on our easy, user-friendly app and web platform.

Here’s a little taste of what our app does:

BUY EASILY
Own crypto in an instant: Coinbase makes buying bitcoin, bitcoin cash, ethereum, ethereum classic, litecoin and more simple and fast. All it takes is a bank account or debit card.

SUPPORTED ASSETS
Bitcoin (BTC), Bitcoin Cash (BCH), Ethereum (ETH), Ethereum Classic(ETC), Litecoin(LTC), Basic Attention Token (BAT)*, 0x, (ZRX)* and USD Coin (USDC)*.

*Available in select territories.

SMART TOOLS
Brand new to crypto? We’ve got you covered. Stay informed with our updates and features that help you build your knowledge and your portfolio, including automatic buys and price alerts.

STAY INFORMED
Keep track of your crypto: Our clear, user-friendly dashboard helps you see prices and the value of your assets, any time of day, anywhere you are through our website or mobile app.

SAFETY FIRST
Over 98% of cryptocurrency is stored securely offline and the rest is protected by industry-leading online security. Your account is also subject to the same scrupulous safety standards, including multi-stage verification and bank-level security. You can even lock the app with a passcode, or remotely disable your phone’s access to the app if it gets lost or stolen.

BEGINNER TO EXPERT, WE’RE HERE
Whether you’re just starting your crypto journey, or a seasoned expert, you’ll find everything you need to build your crypto portfolio on Coinbase.
Take the first step towards blockchain, bitcoin mining, bitcoin games, bitcoin cash games, ethereum games, litecoin games, or bitcoin trading.

NEED MORE HELP?
Visit help.coinbase.com for information and to contact Coinbase Support.","Coinbase, Inc.",https://apps.apple.com/us/developer/coinbase-inc/id588530553?uo=2,588530553?uo=2,Finance,6015,2014-06-21T22:13:36-07:00
835599320,com.zhiliaoapp.musically,TikTok,https://is3-ssl.mzstatic.com/image/thumb/Purple124/v4/11/00/18/110018e4-27a6-ceee-b5c1-d8a2a6fe17de/AppIcon_TikTok-0-0-1x_U007emarketing-0-0-0-7-0-0-sRGB-0-0-0-GLES2_U002c0-512MB-85-220-0-0.png/100x100bb.png,https://apps.apple.com/us/app/tiktok/id835599320?uo=2,0,USD,true,"TikTok is THE destination for mobile videos. On TikTok, short-form videos are exciting, spontaneous, and genuine. Whether you’re a sports fanatic, a pet enthusiast, or just looking for a laugh, there’s something for everyone on TikTok. All you have to do is watch, engage with what you like, skip what you don’t, and you’ll find an endless stream of short videos that feel personalized just for you. From your morning coffee to your afternoon errands, TikTok has the videos that are guaranteed to make your day.

We make it easy for you to discover and create your own original videos by providing easy-to-use tools to view and capture your daily moments. Take your videos to the next level with special effects, filters, music, and more. 

■ Watch endless amount of videos customized specifically for you
A personalized video feed based on what you watch, like, and share. TikTok offers you real, interesting, and fun videos that will make your day.
 
■ Explore videos, just one scroll away
Watch all types of videos, from Comedy, Gaming, DIY, Food, Sports, Memes, and Pets, to Oddly Satisfying, ASMR, and everything in between.
 
■ Pause recording multiple times in one video
Pause and resume your video with just a tap. Shoot as many times as you need.
 
■ Be entertained and inspired by a global community of creators
Millions of creators are on TikTok showcasing their incredible skills and everyday life. Let yourself be inspired.

■ Add your favorite music or sound to your videos for free
Easily edit your videos with millions of free music clips and sounds. We curate music and sound playlists for you with the hottest tracks in every genre, including Hip Hop, Edm, Pop, Rock, Rap, and Country, and the most viral original sounds.

■ Express yourself with creative effects
Unlock tons of filters, effects, and AR objects to take your videos to the next level.

■ Edit your own videos 
Our integrated editing tools allow you to easily trim, cut, merge and duplicate video clips without leaving the app.

* Any feedback? Contact us at https://www.tiktok.com/legal/report/feedback or tweet us @tiktok_us",TikTok Pte. Ltd.,https://apps.apple.com/us/developer/tiktok-pte-ltd/id1322881000?uo=2,1322881000?uo=2,Entertainment,6016,2014-04-02T15:44:45-07:00
544007664,com.google.ios.youtube,"YouTube: Watch, Listen, Stream",https://is1-ssl.mzstatic.com/image/thumb/Purple125/v4/84/1d/9a/841d9afa-769a-8355-5a67-3c846e6e8a92/logo_youtube_color-0-0-1x_U007emarketing-0-0-0-6-0-0-sRGB-0-0-0-GLES2_U002c0-512MB-85-220-0-0.png/100x100bb.png,https://apps.apple.com/us/app/youtube-watch-listen-stream/id544007664?uo=2,0,USD,true,"Get the official YouTube app on iPhones and iPads. See what the world is watching -- from the hottest music videos to what’s popular in gaming, fashion, beauty, news, learning and more. Subscribe to channels you love, create content of your own, share with friends, and watch on any device.

Watch and subscribe
● Browse personal recommendations on Home
● See the latest from your favorite channels in Subscriptions
● Look up videos you’ve watched, liked, and saved for later in Library

Explore different topics, what’s popular, and on the rise (available in select countries)
● Stay up to date on what’s popular in music, gaming, beauty, news, learning and more
● See what’s trending on YouTube and around the world on Explore
● Learn about the coolest Creators, Gamers, and Artists on the Rise (available in select countries)

Connect with the YouTube community
● Keep up with your favorites creators with Posts, Stories, Premieres, and Live streams
● Join the conversation with comments and interact with creators and other community members

Create content from your mobile device
● Create or upload your own videos directly in the app
● Engage with your audience in real time with live streaming right from the app

Find the experience that fits you and your family (available in select countries)
● Every family has their own approach to online video. Learn about your options: the YouTube Kids app or a new parent supervised experience on YouTube at youtube.com/myfamily

Support creators you love with channel memberships (available in select countries)
● Join channels that offer paid monthly memberships and support their work
● Get access to exclusive perks from the channel & become part of their members community
● Stand out in comments and live chats with a loyalty badge next to your username

Upgrade to YouTube Premium (available in select countries)
● Watch videos uninterrupted by ads, while using other apps, or when the screen is locked
● Save videos for when you really need them – like when you’re on a plane or commuting
● Get access to YouTube Music Premium as part of your benefits

Note: If you subscribe via Apple, payment will be charged to App Store Account at confirmation of purchase. Subscription automatically renews unless auto-renew is turned off at least 24 hours before the end of the current period. Account will be charged for renewal within 24 hours prior to the end of the current period at the rate of the selected plan. Subscriptions and auto-renewal may be managed by going to Account Settings after purchase.

Monthly price: $15.99 USD (US, TC) / $19.99 AUD / $20.99 NZD / $155MXN / £15.99GBP / €15.99 EUR (IE, DE, AT, FR, FI, IT, ES, BE, NL, LU) / $15.99 CAD / 149 kr SEK / 149 kr NOK / 249 ₽ RUB / 149 kr. DKK / R$27.90 BRL / CHF19.90 CHF / ¥1,550 JPY / USD$4.99 (UA, AR) / COP$22,900 / CLP$5,500 / S/.26.90 PEN / €10.99 EUR (PT, CY, GR, MT, EE, LT, LV) / ₹169.00 INR / R94.99 ZAR / USD$9.49 (CR, EC, DO, UY, GT, BO, HN, SV, PY, NI, PA, VE, BY, BM, KY) / 32.99 zł PLN / RON34.99 / 239.00 Kč CZK /  Ft2,390.00 HUF / lev14.99 BGN / USD$10.99 (MK) / €9.49 EUR (SK, SI) / ₺21.99 TRY / USD$18.59 (IS) / kn99.99 HRK /  ₪31.90 ILS / dh32.99 AED / Rial32.99 SAR / Rial32.99 QAR / USD$7.99 (BH, KW, OM, LB, PG) / Rp79,000 IDR / NT$230.00 TWD / ฿209.00 THB / ₱209.00 PHP / $88.00 HKD / RM23.90 MYR / $15.98 SGD / ₦1,500.00 NGN / £79.99 EGP

YouTube paid service terms: https://www.youtube.com/t/terms_paidservice.
Privacy policy: https://www.google.com/policies/privacy",Google LLC,https://apps.apple.com/us/developer/google-llc/id281956209?uo=2,281956209?uo=2,Photo & Video,6008,2012-09-11T00:23:19-07:00
389801252,com.burbn.instagram,Instagram,https://is3-ssl.mzstatic.com/image/thumb/Purple125/v4/4d/6e/da/4d6edaef-f2d7-53cf-b81a-e3e23375d4ee/Prod-0-0-1x_U007emarketing-0-0-0-7-0-0-sRGB-0-0-0-GLES2_U002c0-512MB-85-220-0-0.png/100x100bb.png,https://apps.apple.com/us/app/instagram/id389801252?uo=2,0,USD,true,"Bringing you closer to the people and things you love. — Instagram from Facebook

Connect with friends, share what you’re up to, or see what's new from others all over the world. Explore our community where you can feel free to be yourself and share everything from your daily moments to life's highlights.

Express Yourself and Connect With Friends

* Add photos and videos to your story that disappear after 24 hours, and bring them to life with fun creative tools.
* Message your friends with Messenger. Share and connect over what you see on Feed and Stories.
* Create and discover short, entertaining videos on Instagram with Reels.
* Post photos and videos to your feed that you want to show on your profile.

Learn More About Your Interests

* Check out IGTV for longer videos from your favorite creators.
* Get inspired by photos and videos from new accounts in Explore.
* Discover brands and small businesses, and shop products that are relevant to your personal style.
Some Instagram features may not be available in your country or region.","Instagram, Inc.",https://apps.apple.com/us/developer/instagram-inc/id389801255?uo=2,389801255?uo=2,Photo & Video,6008,2010-10-06T01:12:41-07:00
284882215,com.facebook.Facebook,Facebook,https://is4-ssl.mzstatic.com/image/thumb/Purple115/v4/fb/ba/fd/fbbafd57-309c-e1cc-80b4-c5e730c73d5d/Icon-Production-0-0-1x_U007emarketing-0-0-0-7-0-0-sRGB-0-0-0-GLES2_U002c0-512MB-85-220-0-0.png/100x100bb.png,https://apps.apple.com/us/app/facebook/id284882215?uo=2,0,USD,true,"Connect with friends, family and people who share the same interests as you. Communicate privately, watch your favorite content, buy and sell items or just spend time with your community. On Facebook, keeping up with the people who matter most is easy. Discover, enjoy and do more together.
  
Stay up to date with your loved ones:
  • Share what's on your mind, announce major life events through posts and celebrate the everyday moments with Stories.
  • Express yourself through your profile and posts, watch, react, interact and stay in touch with your friends, throughout
  the day.

Connect with people who share your interests with Groups:
  • With tens of millions of groups, you'll find something for all your interests and discover more groups relevant to you.
  • Use the Groups tab as a hub to quickly access all your groups content. Find relevant groups based on your interests with the new discovery tool and recommendations.

Become more involved with your community:
  • Discover events happening near you, businesses to support, local groups and activities to be part of.
  • Check out local recommendations from your friends, then coordinate with them and make plans to get together.
  • Raise funds for a cause that’s important to you, mentor someone who wants help achieving their goals and, in the event of a local crisis, connect with other people to find or give supplies, food or shelter.

Enjoy entertainment together with Watch:
  • Discover all kinds of content from original shows to creators to trending videos in topics like beauty, sports, and entertainment.
  • Join conversations, share with others, interact with viewers and creators and watch together like never before.

Buy and sell with Marketplace:
  • Whether it's an everyday or one-of-a-kind item, you can discover everything from household items to your next car or apartment on Marketplace.
  • List your own item for sale and conveniently communicate with buyers and sellers through Messenger 

Read our Data Use Policy, Terms and other important info in the legal section of our App Store description. 

Continued use of GPS running in the background can dramatically decrease battery life. Facebook doesn't run GPS in the background unless you give us permission by turning on optional features that require this.","Facebook, Inc.",https://apps.apple.com/us/developer/facebook-inc/id284882218?uo=2,284882218?uo=2,Social Networking,6005,2019-02-05T00:00:00-07:00
1288339409,com.sixdays.trust,Trust: Crypto & Bitcoin Wallet,https://is4-ssl.mzstatic.com/image/thumb/Purple114/v4/48/39/73/483973f4-18e9-6462-7f0f-cc2ecea97bdb/AppIcon-0-1x_U007emarketing-0-10-0-85-220.png/100x100bb.png,https://apps.apple.com/us/app/trust-crypto-bitcoin-wallet/id1288339409?uo=2,0,USD,true,"Trust Wallet is the official crypto wallet of Binance. You can send, receive and store Bitcoin and many other cryptocurrencies and digital assets safely and securely with the Trust Wallet mobile app. 

You can even use Trust Wallet to earn interest on your crypto, play blockchain games and access the latest DApps and DeFi platforms. 

Trust Wallet is a fast and secure multi crypto wallet with Binance DEX support, designed for ease of use and perfect for storing your different crypto assets.

Whether you are looking for an Ethereum wallet or Bitcoin wallet, Trust provides a secure system that makes it simple to buy and store multiple cryptocurrencies such as Bitcoin, Ethereum, Tron, Litecoin, and many other ERC20, BEP20 and ERC721 tokens on your device. In recent app updates, we have added XRP wallet support, XLM wallet support, FIL wallet support and EGLD wallet support.
 
Trust Wallet is designed to be the best crypto wallet app by providing a safe and secure experience for our users:
 
- Binance DEX support now available with Trust Wallet / WalletConnect Support
- Integrated Uniswap and PancakeSwap trading directly in the wallet
- Buy Bitcoin or Crypto with EUR or USD
- Binance Wallet - Binance Smart Chain, BEP20 and BEP2 support
- Best digital wallet to securely store private keys on your device
- Ethereum Wallet: Send and request ERC20, ERC721 and many other ERC tokens
- Check your crypto wallet balance, transaction history and other details on your device
- Keep your private key secure with bank-level security
- Use FaceID, Touch ID, or conventional passwords to protect your crypto investments
- Protect all online interactions through the app’s military-grade encryption
- Use Trust Wallet as your cryptocurrency cash app! Use e-money 
 
Investing in crypto is simple - buying Bitcoin and cryptocurrencies can easily be done directly from Trust Wallet, offering you a safe and quick service with capabilities to connect with decentralised exchanges to help manage your crypto portfolio.

Store the following digital assets in your Trust Wallet:
 
Bitcoin Wallet (BTC), Bitcoin Cash (BCH), Litecoin (LTC)
Ripple XRP Wallet (XRP)
Stellar Lumens XLM Wallet (XLM)
TRON Wallet Support (TRX) Tron staking is now available
Bittorrent (BTT)
Ethereum Wallet Support (ETH), Ethereum Classic Wallet Support (ETC)
Doge Wallet and Theta Wallet Support
Tezos Wallet Support (XTZ) and Tezos staking now available
XRP Wallet Support
IoTeX Wallet Support
ZelCash Wallet Support
Qtum / Groestlcoin / Viacoin Wallet Support
Ontology Wallet (Ontology) Support
Cosmos (Atom) Support and cosmos staking now available
ONG Wallet and ONG staking now available
Dash Wallet (DASH)
TomoChain (TOMO)
VeChain Wallet (VET)
Callisto (CLO) & Callisto staking now available
POA Network (POA)
GoChain (GO)
Wanchain (WAN)
Icon (ICX)
Binance Coin (BNB)
Binance USD (BUSD)
Coinbase USD Coin (USDC)
Gemini Dollar (GUSD)
Maker (MKR)
TrueUSD (TUSD)
Zilliqa (ZIL)
OmiseGO (OMG)
Holo (HOT)
ChainLink (LINK)
Dai (DAI)
Augur (REP)
Mithril (MITH)
Pundi X (PXS)
Loom Network (LOOM)
Golem (GNT)
QASH (QASH)
Dragonchain (DRGN)
SALT (SALT)
Kyber Network (KNC)

Store a wide range of ERC20/BEP20/BEP2/ERC721 tokens, with more coins and tokens being added along with additional wallet capabilities in the future!
 
In wallet staking for coins is now available for some projects, with more being added in the future!

We want to become the best cryptocurrency wallet app. If you want to provide feedback, please send us an email at support@trustwallet.com or contact our community from within the app itself.",SIX DAYS LLC,https://apps.apple.com/us/developer/six-days-llc/id535397742?uo=2,535397742?uo=2,Finance,6015,2017-09-26T21:36:37-07:00
454638411,com.facebook.Messenger,Messenger,https://is1-ssl.mzstatic.com/image/thumb/Purple124/v4/48/02/df/4802df6e-f482-eaff-76a9-f4f7fd614598/AppIcon-0-0-1x_U007emarketing-0-0-0-7-0-0-sRGB-0-0-0-GLES2_U002c0-512MB-85-220-0-0.png/100x100bb.png,https://apps.apple.com/us/app/messenger/id454638411?uo=2,0,USD,true,"Be together whenever, with our free* all-in-one communication app, complete with unlimited text, voice, video calling and group video chat features.

CROSS-APP MESSAGING AND CALLING
Connect with your Instagram friends right from Messenger. Simply search for them by name or username to message or call. 

VANISH MODE
Send messages that only last for a moment. Opt in to use vanish mode where seen messages disappear after you exit the chat.

PRIVACY SETTINGS 
New privacy settings let you choose who can reach you, and where your messages are delivered.

CUSTOM REACTIONS
Lost for words? You can customize your reactions, with lots more emojis to choose from.

CHAT THEMES
Choose from fun themes and colors, like Tie-Dye or Love, to make your chats more personal.

WATCH TOGETHER
Watch videos, tv shows, and movies with your friends over Messenger Video Chat and Rooms when you can't be together. Capture every moment and reaction in real-time.

GET THE GROUP TOGETHER WITH ROOMS
Send a link to group video chat with anyone, even if they don't have Messenger. Host up to 50 people with no time limits.

FREE* VIDEO CALLS TO STAY CONNECTED
Keep your friends and family close with unlimited live video chatting.Host group video calls with up to 8 people, with high-quality audio, high definition video, and interactive video features like face filters.

UNLIMITED FREE* TEXT & PHONE CALLS
Skip exchanging phone numbers and simply send a message to your Facebook friends, even if they’re across the world. Enjoy high-quality voice and text messaging on mobile, tablet, and desktop.

TURN OFF THE LIGHTS IN DARK MODE
Give your eyes some rest with a sleek new look that darkens the colors of the chat interface.

RECORD AND SEND VOICE AND VIDEO MESSAGES
When text just won't cut it, just hit record and send. Say, sing, show, or shout it out loud.

EXPRESS YOURSELF WITH STICKERS, GIFS, AND EMOJIS
Use custom stickers to show your creative side. You can even add effects and filters to video calls.

SEND FILES, PHOTOS, AND VIDEOS
There’s no limit to the number of files you want to share with your friends.

PLAN AND MAKE IT HAPPEN
Make plans to get together with polls and more. Suggest a meeting spot or tell friends where you are by sharing your location with just a few taps.

SEND MONEY SECURELY AND EASILY (within US only)
Send and receive money securely and easily with friends and family right in the app by adding your debit card, PayPal account or reloadable prepaid card (single-source cards eligible for sending money only).

CHAT WITH BUSINESSES
Easily connect with your favorite businesses to make reservations, get customer support, find deals and more.

COMPATIBLE ACROSS PLATFORMS
Chat with friends across an array of devices, like desktop, Portal, and others.

Privacy Policy: https://www.facebook.com/about/privacy/

LEARN MORE about Messenger texting and group video chat at: http://messenger.com

* Data rates apply

Some Messenger features may not be available in your country or region.","Facebook, Inc.",https://apps.apple.com/us/developer/facebook-inc/id284882218?uo=2,284882218?uo=2,Social Networking,6005,2011-08-09T12:49:28-07:00
